482;ЗАО «Кошелева Ларионов»;8 (702) 639-31-27;Индонезия;1952-02-04;к. Тулун, наб. Радищева, д. 8/8 стр. 818, 159628
483;Савин Лимитед;8 437 165 64 76;Нигерия;1982-11-10;г. Ербогачен, алл. Парковая, д. 9 стр. 9, 909394
484;Лапин Инкорпорэйтед;8 (796) 304-22-88;Франция;1905-05-16;д. Тикси, алл. Иркутская, д. 365 стр. 2/8, 042301
485;ИП «Гусев»;+7 001 399 4138;Пакистан;1991-01-04;д. Ижевск, алл. Подгорная, д. 8/5 к. 4, 528044
486;ЗАО «Некрасов-Кондратьева»;83871041971;Латвия;2001-08-10;г. Камень-на-Оби, пер. Чапаева, д. 8/1 к. 33, 745785
487;Сысоев Инкорпорэйтед;81384913800;Сенегал;1949-02-03;к. Ступино, пр. Безымянный, д. 3 к. 9/4, 299108
488;ТК Шлюмберже (Schlumberger);+7 749 138 46 77;Камбоджа;1918-10-12;д. Иваново, ул. Лермонтова, д. 3 стр. 6/6, 499376
489;ОАО «Бирюкова-Гуляев»;87109233964;Сингапур;1959-01-22;ст. Подольск, пр. Декабристов, д. 7/2 к. 54, 262615
490;Шарапова Инк;+7 (516) 796-8524;Тонга;1912-08-20;с. Игарка, ш. Плеханова, д. 733 стр. 6/4, 166860
491;Проктер Энд Гэмбл. Дистрибьюторская компания (Procter & Gamble);8 (312) 059-78-30;Азербайджан;1945-05-24;с. Тарко-Сале, пр. Механизаторов, д. 220 к. 997, 675982
492;Данон  (Danone);+7 023 952 5003;Лаос;1921-02-19;ст. Сасово, пр. Прохладный, д. 8/3 к. 3/2, 644213
493;ИП «Сидорова-Беляев»;+7 454 985 9691;Папуа;1997-08-09;с. Снежногорск (Мурм.), ул. Геологическая, д. 184 стр. 584, 460782
494;ОАО «Филиппов-Копылов»;8 (099) 141-8892;Тунис;1904-05-11;г. Ставрополь, наб. Минина, д. 3 стр. 9, 867368
495;ОАО «Чернова-Ширяева»;+7 153 656 35 26;Ангола;2009-09-07;д. Жиганск, алл. Петровская, д. 27 стр. 8, 372489
496;Рогова и партнеры;8 (421) 054-52-66;Коста-Рика;2019-04-19;п. Усть-Кут, наб. Мельничная, д. 6/1, 284024
497;ИП «Титов-Доронина»;+7 827 087 51 39;ЮАР;1921-01-20;клх Мостовской, ул. Набережная, д. 41 к. 8/8, 880281
498;НПО «Хохлова»;+7 267 530 3554;Тринидад и Тобаго;1933-12-05;клх Самара, пер. Пархоменко, д. 8 стр. 77, 211407
499;ИП «Сергеева-Лихачев»;+7 (329) 628-18-03;Панама;1943-11-17;клх Кондопога, пр. Прохладный, д. 3/8, 402161
500;Красильникова Лтд;85897147860;Уганда;1994-02-04;клх Печора, ул. Украинская, д. 8, 193634
501;ООО «Титов, Козлов и Анисимов»;+70123125017;Джибути;1964-06-04;к. Великий Устюг, наб. Черняховского, д. 5, 997929
502;ОАО «Зуев Полякова»;80023174509;Андорра;1973-11-10;с. Стрежевой, пр. Камский, д. 888 стр. 2/2, 256751
503;ЗАО «Жданова, Никифорова и Самсонова»;8 559 036 27 31;Никарагуа;1986-07-27;г. Поярково, пер. Ангарский, д. 9, 818343
504;ЗАО «Филиппова-Родионов»;8 (535) 356-46-55;Габон;1958-08-01;г. Ведено, пер. Солнечный, д. 8, 025769
505;НПО «Селезнева Пахомов»;+7 780 868 74 20;Бенин;1926-02-15;г. Кырен, пр. Жданова, д. 605 к. 825, 027749
506;ИП «Сорокина-Ковалев»;8 (544) 811-0441;Нидерланды;1926-03-26;с. Глазов, ул. Чайковского, д. 9/6, 262616
507;Самсонова Лтд;81341140532;ЮАР;2015-08-12;клх Вилюйск, алл. Волочаевская, д. 5/6, 351049
508;ИП «Анисимова Лазарева»;8 062 801 04 23;Коморы;1912-03-07;г. Адлер, пр. Алтайский, д. 3/9 стр. 976, 991429
509;ЗАО «Блинов-Фокин»;+7 748 085 75 73;Лаос;1919-06-16;клх Поронайск, наб. Промышленная, д. 61, 150393
510;САФМАР;8 709 752 4382;Сент-Винсент и Гренадины;2013-06-23;д. Старая Русса, ул. Калужская, д. 652 стр. 54, 217560
511;ЗАО «Крюкова Лебедев»;+77579061335;Сент-Люсия;2014-09-01;г. Йошкар-Ола, наб. Загородная, д. 31, 983209
512;Гаврилова Лтд;8 960 157 0229;Барбадос;1942-09-16;к. Палана, ш. Орловское, д. 980 стр. 3/1, 221790
513;ЗАО «Вишняков, Иванова и Соловьева»;8 652 530 4469;Словакия;1957-11-16;клх Миллерово, наб. Астраханская, д. 3 к. 37, 876323
514;ИП «Цветков Кондратьев»;8 (545) 855-23-31;Алжир;1981-11-13;п. Иваново, ш. Р.Люксембург, д. 6/4 к. 162, 909729
515;АО «Куликов, Архипова и Якушева»;8 154 080 3922;Маврикий;1940-06-05;с. Ноябрьск, ш. Зеленое, д. 5/9, 191271
516;АО «Мамонтова, Кабанов и Марков»;+7 692 272 88 67;Сан-Томе и Принсипи;1959-02-03;к. Новороссийск, бул. Красногвардейский, д. 73 к. 9/2, 318975
517;Фомичев Лимитед;8 973 226 00 44;Норвегия;2002-03-31;г. Жигулевск, ш. Пионерское, д. 9/8, 149102
518;Северный ветер;+7 (654) 377-5991;Сент-Люсия;2020-02-28;клх Санкт-Петербург, ш. Механическое, д. 8, 863488
519;ЗАО «Рыбаков Миронова»;+7 (168) 763-7129;Руанда;1973-01-01;с. Малая Вишера, бул. Пушкинский, д. 1/3, 702552
520;Константинов Лимитед;8 (434) 253-0951;Мальдивы;1919-07-06;д. Элиста, пер. Невского, д. 6 к. 7, 340478
521;Копылов Лимитед;+7 019 233 44 22;Судан;1949-12-03;к. Хоста, пр. Кедровый, д. 5/4, 462692
522;ЗАО «Орлов Авдеева»;8 650 634 66 23;Ангола;2004-10-29;с. Терскол, наб. Нефтяников, д. 19, 122294
523;ЗАО «Павлова»;84794720053;Вьетнам;1920-01-06;г. Кабанск, наб. Карбышева, д. 593, 409833
524;РАО «Комиссаров Федосеева»;8 989 217 9561;Гаити;2003-01-01;к. Долинск, ш. Пожарского, д. 3/4 к. 2, 434222
525;ИП «Наумов»;8 833 374 46 21;Белиз;1950-03-05;к. Казань, наб. Абрикосовая, д. 6 стр. 3, 583433
526;РАО «Шаров Гаврилова»;8 (418) 842-92-31;Финляндия;1931-02-17;п. Иваново, алл. Тюленина, д. 9/7 к. 321, 375658
527;Казаньоргсинтез;+7 (571) 174-2322;Монако;1960-11-12;д. Лагань, пр. Горный, д. 9 стр. 5/3, 783361
528;ОАО «Зыков»;8 113 978 84 24;Соломоновы Острова;1977-12-15;с. Калязин, ш. Прудовое, д. 1 стр. 7/8, 351884
529;НПО «Капустина Жукова»;8 200 304 60 75;Науру;1991-01-24;ст. Саров (Морд.), наб. Слободская, д. 5/6 к. 1/5, 603028
530;Рогов Групп;8 (782) 814-74-61;Сент-Люсия;1992-10-05;к. Котельнич, наб. Заозерная, д. 4, 875768
531;ОАО «Никитина Прохоров»;+7 891 502 88 34;Великобритания;1947-01-10;д. Нягань, пер. Глинки, д. 70, 045155
532;Доронина Лимитед;81639409696;Саудовская Аравия;1909-01-15;ст. Усть-Калманка, ш. Дружбы, д. 184 к. 144, 804867
533;НПО «Шубина, Куликова и Веселова»;8 680 482 56 68;Иран;1914-10-24;клх Прохладный, бул. Индустриальный, д. 435 стр. 6/5, 611274
534;АО «Захаров Белозеров»;+7 (673) 327-8872;Гватемала;1956-07-25;клх Бодайбо, алл. Гаражная, д. 10, 414721
535;РАО «Кулакова»;8 266 255 4537;Молдавия;2018-05-30;г. Иркутск, пер. Тукая, д. 67, 888938
536;ИП «Федорова, Воронова и Ковалев»;8 363 703 6467;Вануату;1995-10-17;ст. Новый Уренгой, ул. Ольховая, д. 80, 020150
537;Игнатьева и партнеры;+7 923 032 66 15;Малави;1998-06-13;к. Верхнее Пенжино, наб. Шахтерская, д. 23, 574743
538;Константинова Лтд;+7 532 303 74 73;Ирландия;1962-04-01;клх Усть-Ишим, пер. Виноградный, д. 1 к. 5/1, 950590
539;Крылова и партнеры;+7 126 366 8042;Мальдивы;1976-04-14;к. Иваново, ул. Путейская, д. 16 к. 1, 013778
540;ОАО «Белоусов, Рожков и Молчанов»;+7 (064) 105-01-59;Сенегал;2012-09-04;г. Бреды, ул. Тургенева, д. 7/2 к. 84, 747293
541;РТИ;8 (894) 408-39-06;Барбадос;1901-07-27;п. Тамбов, алл. Литейная, д. 94 к. 54, 720156
542;Назаров Лтд;+7 629 010 5372;Эстония;1969-02-13;к. Калачинск, алл. Школьная, д. 6 стр. 67, 113390
543;ИП «Симонова-Силина»;+7 (885) 738-28-94;Словения;1901-01-17;с. Нягань, пр. Нефтяников, д. 9/9 к. 200, 014805
544;Кузьмин Инк;+7 731 659 46 63;Йемен;2009-08-03;с. Ербогачен, бул. Новосельский, д. 16 к. 3, 603766
545;АО «Власов, Белозеров и Крылов»;+7 387 127 8925;Лесото;1974-05-07;ст. Оха, пер. Совхозный, д. 82 стр. 4, 455990
546;Ситникова Лтд;+7 591 594 67 00;Ирландия;1954-08-06;к. Катав-Ивановск, наб. Авиационная, д. 31 стр. 1/6, 872041
547;РАО «Ларионов-Колесников»;+71760772139;Сомали;2017-05-13;клх Краснотурьинск, алл. Ореховая, д. 62, 277611
548;РАО «Фомин-Мартынова»;8 (697) 752-1688;Австрия;1930-07-24;п. Шелагонцы, пер. Рязанский, д. 595, 756415
549;Чернова Лтд;+7 (214) 852-17-66;Сан-Томе и Принсипи;1999-04-05;ст. Шаховская, алл. Магистральная, д. 3 стр. 4, 149429
550;Гришина Лимитед;+7 (947) 594-77-46;Эквадор;1902-10-01;клх Нальчик, пр. Логовой, д. 680, 809325
551;РАО «Терентьева Доронин»;8 147 909 7581;Барбадос;1914-05-09;д. Соль-Илецк, пр. Октябрьский, д. 2/1 стр. 66, 241723
552;НПО «Гришин»;+7 (963) 057-0262;Румыния;1942-09-02;с. Луховицы, бул. Амурский, д. 826 к. 7/7, 772248
553;ИП «Кудрявцева Попова»;+7 851 275 03 24;Украина;1967-04-06;к. Калязин, ул. 40 лет Победы, д. 1, 010856
554;ООО «Константинова-Вишнякова»;+7 497 525 59 77;Киргизия;1988-08-18;с. Тосно, пр. Саратовский, д. 1, 545096
555;РАО «Кондратьев Терентьев»;8 (092) 973-90-62;Португалия;1954-03-16;к. Новый Оскол, бул. Пирогова, д. 95 стр. 573, 668053
556;ТЦ Кунцево Лимитед;8 (386) 125-0465;Эритрея;1930-06-19;д. Липецк, пер. Шахтерский, д. 463, 966045
557;ОАО «Наумов-Ковалев»;8 (642) 032-38-18;Латвия;1971-01-25;ст. Талдом, бул. Тамбовский, д. 877, 655275
558;ЗАО «Сысоева Попова»;8 (932) 780-8774;Фиджи;2008-12-27;к. Туапсе, пр. Матросова, д. 518 стр. 5, 803090
559;РАО «Корнилова Кудряшова»;8 (750) 756-2764;Таджикистан;1973-10-05;г. Ханты-Мансийск, ул. Прудовая, д. 296 к. 77, 346172
560;РАО «Егорова»;+7 864 446 7551;Бенин;1995-06-09;клх Тарко-Сале, ул. Ушакова, д. 4/4, 876826
561;ООО «Федотова, Гаврилов и Третьякова»;8 (465) 934-48-44;Республика Корея;1935-09-18;п. Нефтегорск (Самар.), алл. Угловая, д. 4/4 к. 8/1, 219190
562;НПО «Бирюкова, Титов и Потапов»;8 (308) 150-74-03;Босния и Герцеговина;1957-02-13;д. Миллерово, ш. Республиканское, д. 6/7 стр. 834, 279281
563;Копылова Инк;+7 794 489 06 32;Испания;1932-06-16;д. Киренск, ш. Некрасова, д. 48 стр. 87, 364386
564;ИП «Агафонова, Горшкова и Комаров»;8 671 468 5922;Болгария;1900-06-27;г. Уренгой, ш. Пушкина, д. 397 к. 2/8, 077468
565;ИП «Комиссарова»;8 324 161 41 74;Ливан;1900-01-04;клх Макаров, бул. Мирный, д. 595 к. 60, 662385
566;АО «Коновалова-Шарова»;8 (034) 386-8931;Габон;1928-07-05;к. Лянтор, ул. Физкультурная, д. 700 стр. 8/3, 161501
567;РАО «Щукин»;+7 039 139 5536;Республика Конго;1916-05-22;клх Мирный, наб. Строительная, д. 4/9 стр. 5, 692658
568;РАО «Муравьев-Афанасьев»;+7 (541) 875-8711;Бруней;1908-11-17;с. Кулу, ул. Техническая, д. 8 к. 189, 628605
569;ИП «Кононова»;8 925 652 46 92;Япония;1993-01-13;д. Аргаяш, алл. Тургенева, д. 1/9, 221107
570;ОАО «Колесников Власова»;81774270264;Нигер;1973-11-17;д. Шумиха, ул. Коммунальная, д. 1, 537028
571;НПО «Потапов-Стрелков»;8 722 728 02 85;Израиль;1921-11-18;к. Дудинка, бул. Волгоградский, д. 202 к. 4, 902758
572;НПО «Носов-Цветков»;86426568483;Лесото;1958-11-22;с. Новомичуринск, ул. Молодежная, д. 3/4 стр. 1/6, 190241
573;Мазда Соллерс Мануфэкчуринг Рус;+7 824 915 66 55;Украина;1904-03-10;с. Амурск, наб. Заводская, д. 744, 412675
574;Терентьева Лимитед;+7 (069) 361-81-41;Нигерия;1902-06-03;п. Листвянка (Иркут.), пер. 50 лет Октября, д. 4/2, 110393
575;ОАО «Антонов-Соловьева»;8 000 426 1138;Мозамбик;1965-09-10;ст. Нарым, пер. Шахтерский, д. 2 стр. 6/1, 247640
576;ООО «Гаврилова-Коновалов»;8 849 167 03 90;Литва;1984-07-31;г. Энгельс, ул. Морозова, д. 71 стр. 12, 823330
577;ИП «Дорофеев-Панова»;8 004 643 90 99;Сальвадор;2016-01-12;с. Октябрьское (Челяб.), пр. 70 лет Октября, д. 53, 974343
578;ОАО «Казаков-Авдеева»;+74064295140;Катар;1944-06-18;д. Элиста, ш. Промышленное, д. 582 стр. 5, 134738
579;ООО «Суханов-Никитин»;8 261 447 76 38;Ямайка;1939-02-24;с. Пушкино (Моск.), бул. Локомотивный, д. 3, 582440
580;НПО «Игнатова»;83701666938;Бурунди;1979-11-10;клх Джубга, пер. Монтажников, д. 6, 833679
581;Бобылева Инкорпорэйтед;+79027325323;Мозамбик;1997-02-08;с. Печора, алл. Макаренко, д. 1 стр. 31, 957789
582;Eurasia Drilling Company;84192374113;Финляндия;1906-01-17;ст. Катав-Ивановск, алл. Пожарского, д. 4/5, 969328
583;РАО «Жукова, Кабанова и Самсонов»;+7 106 272 4746;Зимбабве;1961-07-13;ст. Верхнее Пенжино, бул. Светлый, д. 35 стр. 40, 692347
584;Московская инженерно-строительная компания;84394611831;Тонга;1904-03-23;с. Светлогорск (Калин.), пр. Войкова, д. 19 к. 992, 434999
585;ООО «Меркушева, Кулаков и Фролов»;+7 272 061 06 95;Оман;1929-09-06;клх Катав-Ивановск, алл. К.Маркса, д. 1/4 к. 2/5, 404366
586;РАО «Савельева-Кулакова»;8 158 533 9042;Нидерланды;1909-07-19;п. Малоярославец, бул. Шаумяна, д. 5/6 к. 3, 592922
587;РАО «Пахомов-Горбачев»;+7 317 489 6064;Бутан;1965-01-31;с. Щелково, ул. Покровская, д. 3, 079641
588;ОАО «Осипов»;+7 557 332 56 12;Бразилия;2012-04-14;г. Усть-Калманка, пр. Медицинский, д. 58 стр. 23, 161841
589;Жданова Инкорпорэйтед;8 488 056 24 55;Самоа;1952-09-06;г. Черусти, алл. Механическая, д. 7 к. 37, 920016
590;ИП «Гущин-Гусев»;8 (560) 960-4624;Кабо-Верде;1977-06-03;с. Шуя, алл. Красноармейская, д. 9 стр. 5, 737298
591;Попова Инкорпорэйтед;8 (401) 567-04-91;Мавритания;1952-06-10;клх Аша, ш. Жукова, д. 75, 249743
592;ОАО «Савельева»;+7 526 050 80 42;Сейшельские Острова;1909-10-24;ст. Набережные Челны, алл. Алтайская, д. 663, 148148
593;АО «Носова Макарова»;8 (373) 103-6057;Эстония;1981-11-16;ст. Нижневартовск, алл. Металлургов, д. 9/9 стр. 613, 475884
594;Николаев Инк;8 (442) 368-81-69;Египет;1954-03-17;г. Абинск, бул. Красноярский, д. 97 к. 3, 327378
595;Селезнева и партнеры;8 281 404 85 56;Папуа;1936-06-03;с. Таганрог, алл. Баумана, д. 3/5 к. 3/8, 678100
596;НПО «Логинов»;8 (718) 645-3955;Бутан;1951-08-16;клх Сорочинск, пр. Красина, д. 7/6, 860236
597;ОАО «Федотова-Белоусов»;8 463 547 4503;Кабо-Верде;1956-01-24;п. Лотошино, ш. Привокзальное, д. 2, 587094
598;ОАО «Лихачева, Вишнякова и Кошелев»;8 809 800 5339;Исландия;2006-08-26;п. Талдом, пер. Ватутина, д. 453 стр. 2, 547572
599;ОАО «Жданова-Якушева»;8 (393) 144-4038;Испания;1957-02-18;с. Онега, наб. Большая, д. 4, 491201
600;НПО «Куликова»;+7 493 265 7366;Ямайка;1970-05-04;клх Тырныауз, ул. Мусы Джалиля, д. 9, 793244
601;ООО «Власова-Орехова»;+7 115 964 63 22;Дания;1905-09-02;с. Галич, алл. Тупиковая, д. 4/1 стр. 838, 460635
602;ООО «Сысоева»;8 769 052 2749;Ливан;1949-08-25;ст. Лагань, ш. Воровского, д. 4/7, 735217
603;РАО «Гусева-Носов»;8 327 710 8105;Суринам;1915-11-01;клх Поронайск, алл. Высокая, д. 58, 770731
604;ИП «Сысоева-Александров»;+76847708855;Сирия;1952-06-03;к. Сунтар, пр. Механический, д. 4/3 стр. 10, 241865
605;Мясникова Лтд;+7 120 084 0847;Гренада;2005-08-29;с. Тюмень, бул. Октябрьский, д. 8 стр. 955, 104191
606;Харитонов Групп;+7 (772) 265-4864;Гаити;1974-02-16;к. Югорск, алл. Трудовая, д. 19 стр. 26, 571251
607;Силин Инк;8 532 282 1097;Сингапур;2010-04-04;д. Белоярский, алл. Приморская, д. 899 к. 2/3, 977963
608;ООО «Гаврилов»;+7 (105) 875-15-70;Украина;2000-09-30;клх Кропоткин (Краснод.), пр. Розы Люксембург, д. 1/8 к. 88, 130589
609;Антонов Лтд;8 780 386 00 76;Ботсвана;1907-03-29;клх Апшеронск, алл. Жданова, д. 40 к. 64, 312078
610;РАО «Крылова-Сысоев»;+7 275 597 22 56;Гамбия;1917-08-23;клх Обоянь, алл. Механизаторов, д. 8 стр. 5/6, 374683
611;Симонова и партнеры;+71925560224;Испания;2011-07-25;д. Нижневартовск, бул. Высотный, д. 8 к. 60, 608551
612;ОАО «Васильев, Баранова и Сафонова»;+72907945028;Боливия;1967-10-25;п. Мурманск, пр. Макаренко, д. 715 стр. 483, 326833
613;Наумов и партнеры;8 (229) 368-0457;Гватемала;1968-11-26;ст. Туапсе, пр. Интернациональный, д. 1 стр. 700, 940101
614;АФК Система;+7 (216) 414-55-22;Вануату;1957-10-07;клх Яшкуль, ул. Слободская, д. 751, 010661
615;ОАО «Агафонов Мясников»;8 376 078 4628;Турция;2003-05-11;д. Ржев, наб. Прудовая, д. 2/5 стр. 5, 618374
616;Фомина Инкорпорэйтед;8 999 080 91 78;Малайзия;1979-08-24;с. Бомнак, бул. Терешковой, д. 59, 506089
617;ИП «Ермаков-Громов»;+7 382 714 2640;Гондурас;1964-06-15;к. Югорск, наб. Халтурина, д. 9/7 стр. 49, 528861
618;Никитин Лтд;8 (260) 432-8412;Уругвай;1952-08-31;с. Рыбинск, алл. Черемушки, д. 176 стр. 1/6, 026735
619;РАО «Котова»;+7 916 983 1117;Северная Македония;1996-01-06;с. Рязань, ш. Розы Люксембург, д. 955, 412799
620;АО «Туров, Савин и Медведев»;+7 886 230 2830;Коста-Рика;1907-08-17;с. Кабанск, ул. Папанина, д. 6 стр. 161, 752730
621;НПО «Исаева Блохина»;8 676 246 72 04;Канада;2016-03-01;с. Верхнее Пенжино, пр. Раздольный, д. 18, 513636
622;РАО «Уварова-Мамонтова»;8 (782) 460-42-83;Ливан;2008-12-03;г. Плесецк, алл. Мельничная, д. 1, 832644
623;НПО «Сафонов, Герасимов и Лебедев»;8 702 456 2341;Экваториальная Гвинея;1972-01-20;г. Байкальск, наб. Заводская, д. 9/9 стр. 571, 090989
624;Трофимов Инк;+7 (239) 646-4364;Греция;2011-07-05;ст. Яшалта, ш. Российское, д. 329 стр. 4, 768336
625;Протек;8 (791) 279-0070;Ботсвана;1983-06-14;г. Усинск, ш. Березовое, д. 570, 530673
626;ГК Великан;89441462369;Монголия;1935-11-02;ст. Дагомыс, алл. Механизаторов, д. 3/9 к. 8, 690131
627;Калинина Инкорпорэйтед;8 565 114 42 84;Латвия;1988-01-09;д. Усинск, алл. Пролетарская, д. 469 стр. 825, 055334
628;НПО «Кабанов, Мартынова и Одинцова»;89587430889;Республика Корея;2004-07-12;д. Одинцово, пер. Фурманова, д. 246 к. 85, 930034
629;Шилов Инк;86575892451;Маршалловы Острова;2018-09-17;п. Находка, пр. Севастопольский, д. 1/8 к. 29, 248212
630;РАО «Соловьев»;+7 (839) 333-09-83;Марокко;1981-07-22;ст. Чебоксары, алл. Новая, д. 9, 434882
631;ВымпелКом;8 355 909 7260;Мали;1967-06-19;к. Баксан, алл. Тульская, д. 215 стр. 38, 445077
632;ИП «Рогова, Зайцев и Жданов»;88097264785;Испания;2018-06-18;к. Нерчинск, ш. Дзержинского, д. 162, 736004
633;ОАО «Давыдова-Осипова»;+7 829 113 37 73;Чад;1954-09-17;д. Чокурдах, пр. Высоцкого, д. 2/4 к. 98, 982845
634;АО «Осипова Котов»;+7 803 709 95 95;Гвинея;1935-03-06;к. Яшалта, пр. Союзный, д. 2 к. 8, 646563
635;НПО «Фомичева»;8 (531) 816-09-01;Норвегия;1971-07-21;ст. Светлогорск (Калин.), наб. Инженерная, д. 160 к. 8/7, 719856
636;Устинов Групп;84567194559;Сингапур;1950-10-21;ст. Ногинск (Моск.), наб. Кирова, д. 3/5 стр. 3/6, 795778
637;ТЭК Мосэнерго;+7 (244) 297-08-82;Швейцария;1936-02-04;ст. Троицко-Печорск, наб. Гагарина, д. 5, 183433
638;АО «Крюкова-Виноградов»;+7 (320) 125-7332;Туркмения;1908-01-09;п. Дудинка, пер. Суворова, д. 12, 400548
639;ЗАО «Кузнецова-Васильева»;8 023 008 02 11;Украина;1960-06-10;г. Славянск-на-Кубани, наб. Высоцкого, д. 6/5 стр. 795, 448966
640;Группа компаний Пионер;8 085 172 11 05;Сейшельские Острова;2019-04-01;ст. Черусти, пер. Садовый, д. 26 стр. 1, 118396
641;РАО «Савина Евдокимов»;8 869 832 5314;Замбия;1967-06-16;п. Палана, ш. Нахимова, д. 586, 805070
642;ОАО «Владимиров»;8 772 653 9279;Барбадос;1965-02-08;п. Аша, алл. Чайковского, д. 1, 943862
