322;Данилов Лтд;8 (901) 537-3865;Белоруссия;1927-12-10;д. Партизанск, пер. Виноградный, д. 1 к. 3/4, 312054
323;ЗАО «Харитонов, Гурьев и Виноградов»;+7 024 487 41 46;Либерия;1957-11-20;г. Мокшан, ул. Элеваторная, д. 61, 882681
324;НПО «Ковалева Горбачев»;8 (299) 307-2330;Бахрейн;1931-05-04;п. Солнечногорск, ул. Гагарина, д. 204 стр. 897, 443270
325;ЗАО «Мухина-Афанасьева»;+7 132 473 18 60;Аргентина;2022-04-30;клх Тихорецк, пер. Терешковой, д. 726 к. 97, 553540
326;ЗАО «Воронов Логинов»;+7 (999) 612-51-61;Мальдивы;1969-10-13;г. Амурск, бул. Станиславского, д. 3/4, 469446
327;ИП «Сидоров»;8 052 510 99 60;Дания;1986-12-22;клх Артем, ш. 8 Марта, д. 90 стр. 4/9, 442635
328;ОАО «Селиверстова-Суворова»;8 718 164 9139;Сирия;1973-07-04;с. Черусти, ш. Жуковского, д. 5/9 стр. 8/9, 420243
329;ИП «Козлова»;8 (103) 677-9706;Науру;1967-08-03;клх Солнечногорск, бул. М.Горького, д. 142 стр. 3/6, 818460
330;Алтайвагон;+7 (886) 366-9435;Никарагуа;1993-08-05;с. Усть-Ордынский, пер. Свободный, д. 3 к. 304, 862210
331;НПО «Захаров Рогов»;87783383175;Сальвадор;1932-12-31;ст. Адыгейск, ул. Панфилова, д. 61, 306247
332;Прохорова и партнеры;+7 (053) 186-74-80;Китай;1926-07-21;п. Тверь, алл. Иванова, д. 2 стр. 596, 867865
333;ОАО «Журавлев»;+7 (080) 892-50-23;Бахрейн;1988-10-16;д. Ребриха, пер. 1 Мая, д. 9 к. 296, 192751
334;ООО «Субботина-Терентьева»;+7 740 686 54 77;Мальта;1901-01-01;ст. Холмогоры, ул. Короленко, д. 10, 859092
335;ОАО «Силин»;8 747 597 49 94;Гондурас;1926-04-02;клх Данков, наб. Чехова, д. 24, 986053
336;НПО «Михайлов Беляков»;8 133 724 62 53;Кувейт;1978-08-17;к. Агата, пер. Плеханова, д. 276 к. 9/4, 351229
337;Степанов Лтд;81484866008;Боливия;2007-12-22;г. Белгород, алл. Заовражная, д. 5, 836789
338;Ферреро Руссия (Ferrero);+71902596502;Либерия;1937-07-01;к. Белогорск (Амур.), ул. Большая, д. 4, 067983
339;Лебедев Инкорпорэйтед;+7 (313) 129-4353;Южный Судан;1999-02-24;п. Дмитров, ш. Таежное, д. 3/2, 346684
340;Костина и партнеры;+7 (347) 712-78-66;Нидерланды;1919-11-07;клх Усть-Баргузин, алл. Просторная, д. 9/4 к. 802, 140181
341;НПО «Новикова, Сысоев и Журавлев»;+7 (900) 008-39-16;Йемен;1963-03-05;к. Верхоянск, алл. Карбышева, д. 97 к. 457, 554527
342;Медведев Групп;8 (832) 886-92-20;Парагвай;1900-10-22;ст. Амурск, ул. Щербакова, д. 24 стр. 5/9, 953911
343;ИП «Терентьев-Устинов»;8 229 926 2184;Гвинея-Бисау;1975-09-11;с. Листвянка (Иркут.), пер. Мелиоративный, д. 8, 969185
344;РАО «Матвеева Васильев»;8 537 440 7309;Сент-Люсия;1944-08-30;ст. Жиганск, алл. Кооперативная, д. 640 к. 4/4, 118700
345;Денцу Эйджис Си Эс (Dentsu);+7 (926) 413-78-32;Суринам;1939-07-23;д. Моршанск, бул. Мельничный, д. 8/4 к. 96, 182350
346;ОАО «Рыбаков Александров»;8 (129) 358-03-61;Норвегия;1968-05-10;д. Ребриха, наб. Ушакова, д. 3/4 к. 979, 543158
347;ОАО «Панова Поляков»;8 (451) 552-31-06;Сингапур;1970-03-20;ст. Дудинка, алл. Мая 1, д. 98 стр. 8/1, 509838
348;ОАО «Филиппова, Крылов и Быкова»;+7 (733) 330-92-51;Венгрия;1955-08-31;п. Норильск, пер. Войкова, д. 982 стр. 4, 970422
349;Комус;8 388 411 80 11;Таджикистан;2013-11-01;ст. Заводоуковск, ш. Станиславского, д. 8, 406691
350;Группа О'кей;8 (477) 160-2427;Колумбия;1994-03-10;с. Рыльск, бул. Локомотивный, д. 4 стр. 1/7, 028882
351;ИП «Ковалев, Колесникова и Вишнякова»;8 830 071 5772;Молдавия;1932-07-30;ст. Сыктывкар, алл. Октябрьская, д. 39 к. 8, 990618
352;ИП «Сорокин, Туров и Молчанов»;8 (753) 788-4394;Монако;1930-03-04;д. Нефтекамск, пер. Калинина, д. 8/1 к. 362, 745889
353;Системный оператор Единой энергетической системы;+7 (744) 818-5192;Катар;1961-04-20;д. Ковров, ул. Большая, д. 6 стр. 4, 952095
354;Евсеева Инкорпорэйтед;+7 846 328 57 69;Республика Корея;1980-02-11;д. Сальск, бул. Братский, д. 2 стр. 2/1, 863428
355;НПО «Ефремова, Копылов и Кондратьева»;+75827481939;Сьерра-Леоне;1908-04-29;с. Долинск, алл. Комарова, д. 2/9 к. 5/1, 896301
356;ООО «Михайлов, Ершов и Орехов»;+7 934 630 0805;Республика Корея;1939-12-22;п. Кизляр, ул. Новостройка, д. 678, 156408
357;ОАО «Сазонова, Полякова и Никифоров»;+7 (001) 587-34-63;Кения;1926-11-09;клх Ахтубинск, наб. Балтийская, д. 964 к. 2, 685065
358;РАО «Панов, Герасимов и Рябов»;+7 (811) 538-7563;Бурунди;1902-06-22;к. Баксан, ш. Юбилейное, д. 1 стр. 72, 907189
359;ИП «Шестакова-Быков»;+7 099 399 7443;Пакистан;1949-12-12;п. Прохладный, бул. Шоссейный, д. 7/2 к. 4, 895962
360;ОАО «Рожков Орехов»;8 (734) 902-23-80;Аргентина;1940-12-16;п. Волоколамск, пер. Есенина, д. 393 к. 683, 567791
361;ООО «Осипов, Кулакова и Воробьев»;8 (827) 845-3030;Венесуэла;2001-10-20;к. Луховицы, наб. Малая, д. 592 к. 7, 065926
362;ОАО «Родионова Анисимова»;+7 738 622 91 88;Оман;1995-10-20;п. Благовещенск (Амур.), ул. Широкая, д. 449 к. 3/6, 038154
363;ООО «Голубев Пахомова»;8 681 697 4982;Эсватини;1931-04-09;клх Раменское, ул. Ярославская, д. 47 стр. 18, 133513
364;ПК Борец;8 (377) 365-49-17;Греция;2017-02-01;г. Бавлы, ш. Астраханское, д. 9 стр. 2, 351426
365;Дорофеев Инк;8 (663) 542-4178;Испания;1912-09-10;с. Певек, ш. Украинское, д. 375, 103923
366;Белозеров Лтд;+77635145226;Бахрейн;2002-05-08;к. Видное, наб. Олимпийская, д. 611 стр. 9/3, 684908
367;РусГидро;+7 (382) 878-62-83;Бутан;1968-11-13;с. Бомнак, бул. Маркса Карла, д. 2/8 стр. 15, 489166
368;АО «Андреев»;+7 168 126 4901;Судан;2016-09-18;п. Всеволожск, алл. Воровского, д. 5 к. 56, 377701
369;ИП «Сидорова, Исаев и Дорофеева»;+7 476 127 5934;Уругвай;1944-05-17;клх Тимашевск, наб. Кольцевая, д. 5, 871080
370;АО «Авдеева-Вишнякова»;+7 571 536 15 81;Индия;1969-11-30;ст. Лабытнанги, алл. Лесхозная, д. 326 к. 616, 732364
371;ООО «Мамонтов-Сысоев»;8 739 006 75 68;Куба;1986-02-27;п. Ухта, ул. Черемушки, д. 3 стр. 9/8, 088325
372;НПО «Беляева-Якушева»;+7 946 229 2501;Ангола;1994-09-11;г. Радужный, ш. Светлое, д. 5, 913371
373;Степанова Инкорпорэйтед;+7 (552) 453-24-29;Китай;2012-05-09;с. Рязань, ул. Рылеева, д. 8 к. 8, 552273
374;Родионова Групп;80044617701;Сан-Марино;1940-01-22;д. Краснокамск, бул. Автомобилистов, д. 96 к. 308, 215069
375;ООО «Некрасов, Прохоров и Капустина»;8 482 662 79 90;Исландия;1926-05-18;клх Нижнекамск, пер. Курчатова, д. 79 к. 11, 925563
376;Мария-Ра;+7 (573) 681-88-56;Израиль;2004-01-20;д. Серов, ул. 60 лет СССР, д. 21 стр. 847, 047409
377;НПО «Артемьева-Бобылев»;8 470 480 3212;Мозамбик;1913-04-12;к. Сусуман, бул. Троицкий, д. 15 стр. 44, 105000
378;НПО «Зиновьева-Шашков»;87176010932;Монголия;1901-12-19;к. Талдом, алл. Пролетарская, д. 545 к. 28, 129321
379;РАО «Капустин, Костина и Зиновьева»;+7 (050) 159-62-20;Соломоновы Острова;1977-12-20;г. Карабудахкент, наб. Большая, д. 8 стр. 89, 304928
380;Главное управление обустройства войск (ГУОВ);+7 664 165 84 12;Гвинея-Бисау;1959-03-26;к. Чебоксары, пер. Дружба, д. 4, 123590
381;РАО «Давыдова, Шарапова и Некрасова»;+7 (996) 470-9588;Фиджи;1972-03-25;клх Буйнакск, наб. Красная, д. 1/5 к. 15, 005329
382;Медведев Инкорпорэйтед;+7 312 674 8938;ЮАР;1957-11-13;д. Пышма, наб. Морозова, д. 796 стр. 8, 576353
383;Эркафарм;8 (857) 412-92-98;Черногория;1919-12-15;г. Тамбей, пр. Глинки, д. 2 стр. 6, 075038
384;РАО «Николаев-Муравьева»;8 (406) 087-67-62;Чили;1946-03-29;п. Кирово-Чепецк, наб. Гагарина, д. 67, 458205
385;НПО «Шаров, Афанасьев и Сорокин»;+7 (935) 570-51-94;Багамские Острова;1901-03-30;ст. Аргаяш, наб. Пригородная, д. 402, 405903
386;Владимиров Инк;8 195 570 2634;Доминика;1975-09-12;д. Красноселькуп, наб. Дружбы, д. 81 стр. 2, 553894
387;НПО «Кузьмина»;+7 233 006 90 76;Мексика;1924-06-19;ст. Саратов, бул. Тепличный, д. 32 к. 7, 052975
388;Группа РЕСО;8 291 595 03 58;Республика Корея;1942-06-23;с. Уварово, алл. Суворова, д. 8/7, 708992
389;ИП «Белоусов Прохоров»;+7 059 873 27 24;Малави;1929-07-02;к. Энгельс, пр. Карбышева, д. 66 к. 3/4, 837298
390;Алексеев Лтд;86489909200;Сингапур;1995-04-22;г. Солнечногорск, ш. Ягодное, д. 5/9 стр. 72, 838671
391;ОАО «Лихачев, Ермакова и Овчинникова»;8 769 239 2136;Ливан;1906-03-06;г. Рубцовск, ш. Большевистское, д. 29 стр. 264, 101464
392;Кузнецов Инк;+7 (930) 781-7146;Палау;1914-09-12;п. Миллерово, бул. Крымский, д. 670 к. 1/4, 917167
393;РАО «Кудрявцева-Князев»;83549431470;Мавритания;1970-12-27;к. Белый Яр (Томск.), бул. Рылеева, д. 995 стр. 975, 339233
394;ЗАО «Миронов»;82578097359;Чехия;1968-11-30;г. Белокуриха, ш. Главное, д. 996, 742204
395;Группа Магнезит;+7 (843) 470-64-84;Сан-Марино;1967-06-29;д. Александровск-Сахалинский, бул. Ставропольский, д. 7/5, 207286
396;Башкирская содовая компания;+7 (859) 658-99-60;Украина;1943-03-11;п. Псков, пер. Матросова, д. 45 стр. 860, 044039
397;РАО «Емельянов-Прохорова»;8 886 703 5420;Пакистан;2011-09-25;к. Чусовой, пр. Дачный, д. 559, 733022
398;ЗАО «Ермаков»;+72777490629;Коморы;1993-05-28;п. Терней, пр. Бажова, д. 13 стр. 430, 610039
399;ГК Титан;8 (330) 723-88-51;Бутан;1981-02-02;г. Мостовской, бул. Балтийский, д. 88 к. 4/2, 439387
400;ИП «Ершова, Исаков и Степанов»;+7 763 507 5093;Гондурас;1989-06-20;клх Амурск, ул. Ключевая, д. 578 к. 4, 092340
401;АО «Кондратьева-Кузнецова»;+7 751 265 37 51;Либерия;1990-02-16;клх Северо-Курильск, наб. Инженерная, д. 75, 010025
402;ЗАО «Владимирова, Шаров и Артемьева»;8 199 060 74 13;Туркмения;2007-01-30;к. Кемерово, алл. Чехова, д. 680 стр. 1, 962985
403;ЗАО «Буров, Лобанова и Борисова»;82855450332;Мавритания;1915-06-05;к. Волоколамск, пер. Сплавный, д. 60, 302227
404;АО «Попов, Федорова и Кузнецов»;8 (437) 365-8637;Сербия;1911-03-15;клх Кинешма, наб. Кубанская, д. 43 стр. 53, 120354
405;ОАО «Мишина-Лаврентьева»;+7 (148) 623-9472;Гвинея;2017-01-10;к. Урюпинск, наб. Прохладная, д. 31 стр. 53, 380677
406;Кабанова Лтд;+7 (098) 806-7163;Кувейт;2001-12-11;клх Гдов, бул. Ярославский, д. 1/7 к. 2, 729330
407;ИП «Селезнев»;82526493803;Бруней;1909-11-11;ст. Усть-Джегута, наб. Степная, д. 966, 521242
408;ЗАО «Поляков»;+7 (314) 143-2956;Швеция;1960-12-16;г. Губаха, пр. Малиновый, д. 6/8, 714464
409;ИП «Бурова»;8 (517) 593-48-30;Панама;1943-07-31;г. Меренга, пр. Черняховского, д. 3 к. 500, 765751
410;Российские железные дороги;8 (951) 891-15-24;Мьянма;2011-11-06;г. Воронеж, ш. Базарное, д. 1/1 к. 6/5, 654900
411;Merlion;+7 (738) 376-4580;Куба;2008-07-19;с. Енисейск, алл. Омская, д. 170, 863074
412;ИП «Белозерова, Терентьева и Федосеев»;+7 (167) 443-4961;Филиппины;1935-06-21;с. Пушкинские Горы, пр. Ленский, д. 1, 737272
413;Авиакомпания Икар;8 270 389 3376;Мавритания;2006-02-08;клх Валдай, алл. Мелиоративная, д. 6/1, 854176
414;Гурьев Инк;+7 960 633 0273;Куба;1931-08-04;д. Улан-Удэ, ул. Малиновая, д. 6/2 стр. 2, 694240
415;ОАО «Петухова»;84110752690;Словения;2020-03-22;клх Батайск, пр. Островского, д. 9, 593249
416;ИП «Панова»;+7 (267) 578-9016;Ботсвана;1976-01-05;д. Новосибирск, ш. Азина, д. 36, 332557
417;Модум-транс;8 (820) 963-42-11;Тонга;1965-04-26;г. Нефедова, алл. Ангарская, д. 7/2 к. 1, 024887
418;АО «Семенова Титова»;+7 (551) 686-8068;Джибути;1947-03-09;п. Городовиковск, бул. Войкова, д. 6/6 стр. 238, 220535
419;Афанасьев Лимитед;8 842 068 50 52;Сингапур;1956-08-20;клх Туапсе, ш. Белинского, д. 299 стр. 454, 043016
420;ООО «Михайлова»;8 410 519 45 46;Азербайджан;2000-05-27;д. Елабуга, ш. Ленское, д. 142 к. 924, 004137
421;ЗАО «Павлов, Лыткина и Белозеров»;82889359145;Мозамбик;1987-04-08;к. Елатьма, пер. Луначарского, д. 8 к. 8, 255594
422;АО «Лихачева-Борисова»;+7 428 923 72 57;Сан-Марино;2005-06-10;д. Ямбург, бул. Павлика Морозова, д. 4 стр. 466, 209606
423;Герасимова Инк;8 (804) 444-6314;Восточный Тимор;1935-11-03;г. Ачхой Мартан, пр. Больничный, д. 3 стр. 1, 305156
424;Гурьев Лимитед;89618625651;Албания;1958-08-27;к. Кузнецк, бул. Ульяновский, д. 8 к. 84, 981541
425;Никифоров Инкорпорэйтед;8 840 655 8688;Никарагуа;1999-01-15;к. Жигулевск, ш. Кошевого, д. 32 стр. 798, 212470
426;НПО «Белозеров-Савельева»;+7 (373) 556-4249;Южный Судан;1976-02-21;д. Черский, алл. Весенняя, д. 149 к. 4, 199931
427;НПО «Кулагин-Исакова»;+7 (185) 730-3234;Гвинея;1968-11-08;п. Королев, бул. Черноморский, д. 3/6 к. 967, 513495
428;ОАО «Куликов»;8 (995) 290-63-33;Багамские Острова;1944-08-04;г. Шелехов, ш. Портовое, д. 853, 034139
429;ООО «Воронцова Харитонов»;+7 (828) 407-9028;Мексика;1911-07-15;п. Верещагино (Перм.), наб. Кирпичная, д. 5 стр. 10, 467975
430;ОАО «Лапина»;8 (951) 578-4482;Катар;2006-01-01;г. Волхов, бул. Харьковский, д. 881 к. 699, 174013
431;Сэтл групп;+7 (875) 476-97-53;Литва;1901-07-02;д. Сузун, ш. Седова, д. 9/6 стр. 65, 854587
432;ОАО «Гурьев»;8 998 086 6806;Южный Судан;1997-01-24;клх Карачаевск, пер. Фрунзе, д. 54 к. 7, 040735
433;ООО «Петухова Якушев»;+76326221113;Зимбабве;1928-04-13;п. Саров (Морд.), ул. Комсомольская, д. 77 к. 27, 828687
434;ОАО «Евдокимова-Галкин»;89636083202;Киргизия;1925-11-15;к. Уссурийск, бул. Республиканский, д. 7 стр. 95, 675899
435;Группа Синара;80294537963;Доминиканская Республика;1900-09-08;ст. Южноуральск, алл. Коммунальная, д. 7/6 стр. 5/7, 755713
436;АО «Титова, Виноградова и Киселев»;+7 (197) 781-3396;Зимбабве;1988-07-15;п. Арзамас, пр. Лунный, д. 6/5 к. 2, 733354
437;ИП «Лазарев»;86357849573;Ливия;1969-03-21;клх Владимир, пер. Тельмана, д. 7/5 стр. 2/6, 183806
438;Емельянов и партнеры;8 659 923 3941;Центральноафриканская Республика;2003-10-22;г. Гдов, ул. Курчатова, д. 1 стр. 8, 532312
439;НПО «Громова Соловьева»;+7 208 947 32 72;Бурунди;1903-08-10;клх Арсеньев, ул. Пожарского, д. 7 стр. 89, 296391
440;ИП «Гусев, Савина и Юдина»;+72920551121;Камбоджа;1965-05-14;д. Омск, ул. Невского, д. 5/3 стр. 6/1, 267936
441;НПО «Князев-Наумов»;+7 383 109 28 29;Перу;1948-10-20;с. Бодайбо, ул. Щетинкина, д. 999, 856185
442;ООО «Белоусова»;+78126307921;Гаити;1910-02-01;клх Чита, пер. Шишкина, д. 782, 844176
443;РАО «Молчанова-Горбачев»;8 847 020 40 30;Словения;1982-05-30;с. Азов (Рост.), пер. Дорожный, д. 8/1 к. 574, 870087
444;ОАО «Дроздова, Воробьев и Павлова»;8 (066) 143-66-88;Антигуа и Барбуда;2009-09-21;г. Тарко-Сале, бул. Энергетический, д. 3, 868498
445;ИП «Самсонова Артемьев»;+7 (997) 071-6749;Латвия;1975-12-19;с. Хоста, бул. Урожайный, д. 74, 834002
446;РАО «Куликова-Трофимова»;8 (164) 175-17-91;Ирак;1963-01-10;д. Хасавюрт, ш. Щербакова, д. 107 стр. 8/2, 364510
447;Славнефть;+7 (656) 608-62-04;Центральноафриканская Республика;1931-08-18;к. Лабинск, алл. Победы, д. 7 стр. 2/9, 436978
448;НПО «Титова Мухина»;+7 (027) 842-23-77;Никарагуа;1911-01-10;ст. Смирных, бул. Профсоюзный, д. 7, 802527
449;РАО «Гурьева, Мясников и Михеев»;+7 553 792 60 98;Гамбия;1997-03-21;п. Домодедово, пер. Кленовый, д. 3/3, 830399
450;НПО «Тимофеев»;+7 (872) 692-08-71;Самоа;1974-06-10;клх Усть-Илимск, пер. Коммунистический, д. 3/1, 287740
451;Григорьева и партнеры;+7 431 950 3533;Индонезия;2013-10-18;с. Белорецк, алл. Крайняя, д. 862, 608123
452;Филатова и партнеры;+7 (995) 325-5738;Йемен;1904-05-27;п. Шерегеш, бул. Сельский, д. 6, 002066
453;Кулакова и партнеры;+76524427198;Мали;1985-05-23;клх Алапаевск, алл. Таежная, д. 98, 760155
454;ИП «Дроздов Елисеев»;+7 (359) 915-31-65;Уганда;1916-04-16;д. Палана, бул. Мельничный, д. 8/8 к. 5/6, 685073
455;НПО «Федоров, Евдокимова и Филиппова»;+7 (360) 850-6886;Тринидад и Тобаго;1943-03-10;г. Нязепетровск, пер. Набережный, д. 365 стр. 54, 389032
456;ООО «Галкина»;+77945888927;Ирак;1944-02-12;с. Юрюзань, наб. Сенная, д. 9, 818235
457;Владимирова Групп;+7 188 120 98 42;Бельгия;1937-06-28;г. Углич, пр. Чехова, д. 905 стр. 2/4, 815643
458;АО «Маслова Тетерин»;8 (720) 235-49-55;Ливия;1989-08-03;п. Переславль-Залесский, наб. 50 лет Победы, д. 4 к. 2, 459842
459;ЗАО «Панфилов, Бобылева и Капустин»;+73900770938;Турция;1990-09-05;с. Камышин, пер. Тупиковый, д. 632 стр. 8/1, 063059
460;НПО «Ермаков, Кулакова и Егорова»;+7 647 389 21 46;Ливан;1928-07-11;п. Мезень, ш. Водников, д. 7 стр. 522, 348069
461;ОАО «Жданов»;85073540133;Сьерра-Леоне;1948-01-01;с. Пенза, пр. Главный, д. 7 к. 3, 910309
462;ЗАО «Никифорова»;+7 564 442 05 83;Мали;1983-05-16;д. Торжок, наб. Металлургов, д. 38 стр. 1, 941280
463;РАО «Дьячкова»;+77917053086;Киргизия;2011-08-03;д. Канск, ш. Высоцкого, д. 2/7 стр. 3, 499984
464;НПО «Устинова-Наумова»;84413285444;Исландия;1914-05-29;п. Жигулевск, наб. Радужная, д. 4/3 стр. 7, 848988
465;НПО «Соловьев Кондратьева»;8 (484) 041-91-69;Чехия;1943-07-20;п. Обоянь, ш. Николаева, д. 876 к. 917, 164104
466;Новиков Инк;+7 (238) 865-6165;Ливия;1968-09-10;к. Верхнее Пенжино, алл. Октября, д. 5/9 к. 692, 131327
467;Фокина Лтд;+7 (893) 572-18-85;Белиз;1909-05-07;п. Яхрома, бул. Баумана, д. 8, 452368
468;Транскапиталбанк;8 (869) 822-22-29;Болгария;1910-08-26;г. Славгород, бул. Советов, д. 8 стр. 81, 114464
469;РАО «Носков, Блохина и Мишин»;+73167726439;Эквадор;1905-12-20;п. Хабаровск, ш. Коминтерна, д. 8/3 стр. 500, 586841
470;ООО «Белоусов»;+76715150631;Таджикистан;1945-05-21;к. Наро-Фоминск, ш. Полтавское, д. 6 стр. 938, 860427
471;НПО «Кабанова, Соколова и Брагин»;8 (611) 500-88-32;Республика Конго;2003-04-07;г. Волоколамск, наб. Ореховая, д. 2/7, 718198
472;АО «Фролова»;8 139 245 4566;Албания;1994-02-13;ст. Ногинск (Моск.), пр. Толстого, д. 6 стр. 97, 830245
473;ИП «Воронцов Рожков»;+7 480 303 87 17;Тунис;1981-12-12;к. Макушино, ш. Нижнее, д. 4, 772418
474;НПО «Исаков-Павлова»;+7 087 581 70 26;Португалия;1902-03-30;г. Ханты-Мансийск, алл. Севастопольская, д. 3 стр. 7, 668971
475;Громова и партнеры;8 (228) 792-2140;Лихтенштейн;1995-01-21;д. Шаховская, пр. Украинский, д. 92 к. 720, 506307
476;Устинов и партнеры;8 (848) 791-05-59;Руанда;1987-10-07;к. Биробиджан, алл. Зеленая, д. 172, 189246
477;Агафонова Инкорпорэйтед;8 310 680 33 98;ОАЭ;1924-05-20;г. Калуга, ул. Нижняя, д. 319, 106565
478;Тимофеева Лтд;8 191 276 37 68;Гренада;2015-05-20;г. Сунтар, бул. Загородный, д. 72 стр. 181, 249282
479;АО «Федорова, Филатов и Максимова»;+7 (594) 624-6870;Чили;1964-03-09;ст. Мытищи, ул. Подстанция, д. 52, 713134
480;Осипов Инкорпорэйтед;8 202 879 1809;Сирия;1923-05-31;д. Норильск, пер. Приозерный, д. 1/6, 021677
481;ООО «Субботина»;8 (213) 222-24-35;Словения;1931-05-22;клх Дудинка, пер. Стахановский, д. 328, 401677
