643;ЗАО «Лазарева, Андреев и Поляков»;88770960480;Мали;1955-12-01;д. Ржев, алл. Чапаева, д. 804 к. 1/1, 801671
644;ЗАО «Лихачева Колесников»;+7 231 648 4263;Ямайка;1950-08-04;ст. Витим, ш. Украинское, д. 4/4 к. 5, 789658
645;ЗАО «Анисимова, Соколова и Цветкова»;8 (266) 299-2226;Сан-Марино;1961-05-02;к. Вологда, бул. Сенной, д. 519 к. 1/5, 239194
646;ИП «Лихачев, Копылова и Кузнецов»;+7 (145) 479-2082;Ливия;1914-03-19;к. Саров (Морд.), ул. Главная, д. 5 стр. 69, 426767
647;НПО «Хохлова-Захаров»;+7 (626) 350-15-62;Кабо-Верде;1965-08-25;п. Находка, ш. Заозерное, д. 1/1 к. 631, 585084
648;ОАО «Никитин Князева»;+7 598 517 3426;Доминиканская Республика;1904-07-02;клх Мытищи, бул. Нефтяников, д. 541, 718918
649;ОАО «Лаврентьева, Мясникова и Белоусов»;8 326 553 73 98;Саудовская Аравия;2002-07-02;п. Карабулак, пр. Челюскинцев, д. 3/4 стр. 7/5, 990182
650;ИП «Баранова, Колобов и Гуляева»;8 (927) 773-42-26;Багамские Острова;1964-08-19;г. Жигулевск, ул. Мельничная, д. 83 к. 944, 166042
651;Лапина Инк;+7 (216) 234-2069;Непал;2019-11-20;д. Костомукша, ул. Колхозная, д. 9/6 к. 81, 823608
652;Саткинский чугуноплавильный завод;+7 (035) 692-0294;Гвинея;1912-07-19;клх Новосибирск, пр. Крылова, д. 261 стр. 7/7, 797672
653;ИП «Одинцов»;+7 (840) 301-52-65;США;1921-08-14;ст. Каменск-Шахтинский, наб. Сиреневая, д. 9/1 стр. 967, 335726
654;ООО «Котова»;+7 466 650 32 59;Молдавия;1966-10-30;к. Шахты, пр. Льва Толстого, д. 8/4, 386742
655;Орлов Лимитед;8 (391) 806-06-28;Нигер;1913-06-06;клх Ейск, бул. Подлесный, д. 5/5 к. 35, 359190
656;СБСВ-Ключавто;82715185476;Нигер;1901-05-18;клх Киржач, пер. Колхозный, д. 526 стр. 358, 834047
657;ООО «Беспалова-Пестов»;8 (551) 431-4411;Камбоджа;1977-12-29;г. Нарым, наб. Совхозная, д. 404, 802004
658;Быков Групп;8 (182) 934-6857;Сент-Винсент и Гренадины;1957-02-01;г. Невельск, пр. Циолковского, д. 5, 435869
659;ОАО «Родионов»;8 (404) 342-96-81;Непал;2014-07-01;п. Тикси, пр. Водопроводный, д. 4 к. 46, 408663
660;ЗАО «Жуков Шашков»;+7 987 134 58 86;ЮАР;1995-05-09;п. Городовиковск, бул. Театральный, д. 913, 541339
661;ИП «Щербаков-Самойлова»;+7 (897) 873-1205;Гвинея;1963-10-13;г. Морозовск, алл. Калужская, д. 1 к. 4, 060441
662;НПО «Селезнев-Гордеева»;+7 (203) 655-5254;Гана;1998-12-06;с. Волоколамск, бул. Мая 1, д. 90 к. 572, 513668
663;Бирюков Инкорпорэйтед;82227891654;Науру;1958-05-20;к. Шилка, пер. Совхозный, д. 916, 446540
664;ОАО «Дьячкова Ильин»;+7 690 938 52 95;Того;1955-03-14;к. Ейск, бул. Шаумяна, д. 8, 360993
665;ОАО «Суворова Михеев»;+79035924632;Иран;1997-11-24;с. Александровск-Сахалинский, наб. Пограничная, д. 650 к. 927, 186277
666;Блохин Инкорпорэйтед;+76906652729;Зимбабве;1997-12-08;д. Карпинск, наб. Индустриальная, д. 5/3 к. 219, 126135
667;АО «Горбунова-Артемьев»;+7 (268) 569-0214;Сомали;1977-06-18;г. Братск, бул. Строителей, д. 1 к. 3, 502595
668;Луидор;8 (214) 633-73-57;Гвинея-Бисау;1947-10-05;д. Юровск, пр. Новгородский, д. 759 стр. 12, 543614
669;АО «Ефремова-Харитонова»;8 (445) 903-98-78;Саудовская Аравия;2007-06-20;клх Лабытнанги, алл. Театральная, д. 36 стр. 5/9, 591060
670;АО «Абрамова Панфилов»;+7 (907) 815-96-24;Греция;1929-08-18;д. Миллерово, бул. Чайкиной, д. 652 стр. 488, 710037
671;РАО «Устинов, Пестова и Григорьева»;8 442 975 50 11;Куба;1950-10-06;д. Домбай, наб. Маяковского, д. 3 к. 2, 219717
672;Шестаков Групп;8 (042) 327-7747;Чад;1926-01-27;клх Аргаяш, ш. Ольховое, д. 4/3, 470515
673;ИП «Горшкова-Дроздов»;+7 513 692 2112;Сент-Винсент и Гренадины;1951-12-31;клх Жуковский, наб. Клубная, д. 583 стр. 6/6, 695231
674;РАО «Фомин-Герасимов»;+7 (444) 670-6030;Ирландия;1931-09-17;г. Мостовской, алл. Белинского, д. 944 к. 25, 161734
675;АО «Петров-Щербаков»;+7 845 590 8358;Португалия;1903-08-08;г. Мценск, ш. Космодемьянской, д. 357 к. 72, 201336
676;АО «Ефремова, Зуев и Афанасьева»;+7 (326) 432-22-10;Сингапур;1969-03-30;п. Воткинск, наб. Майская, д. 1 стр. 59, 950572
677;НПО «Медведев, Смирнов и Маслов»;82341885219;Бразилия;1969-04-13;клх Кыштым, наб. Городская, д. 326 стр. 9, 734761
678;Новикомбанк;85773670196;Молдавия;1922-11-25;д. Оха, ш. Энгельса, д. 44 стр. 3, 398149
679;АО «Беляева»;8 763 549 79 05;Гватемала;1918-01-12;ст. Люберцы, пр. Береговой, д. 36 к. 1/5, 770091
680;ООО «Тарасов-Громов»;8 (949) 358-29-88;Россия;1936-02-08;клх Кущевская, пер. Школьный, д. 760, 680346
681;А Групп;+7 767 701 1755;Бенин;2012-09-05;к. Снежинск, бул. Челюскинцев, д. 747 стр. 764, 244778
682;ИП «Симонов-Мясников»;8 (857) 906-1013;Экваториальная Гвинея;1964-02-08;клх Москва, пр. Казанский, д. 7/3 стр. 34, 630053
683;АО «Меркушев Белоусов»;+7 (819) 629-6186;Индия;1913-06-02;п. Южноуральск, наб. Минская, д. 3 к. 30, 954614
684;Гуляев Инкорпорэйтед;+7 (623) 321-0363;Сальвадор;1972-06-16;клх Кузнецк, ул. Урожайная, д. 67 стр. 7, 036532
685;ООО «Куликов»;8 (583) 869-9288;Экваториальная Гвинея;1913-09-25;клх Октябрьское (Хант.), ш. Московское, д. 35 стр. 259, 506613
686;ОАО «Гуляева-Захаров»;+7 068 630 91 35;Сьерра-Леоне;2006-10-18;клх Вязьма, наб. Социалистическая, д. 6/7 стр. 5/1, 111262
687;НПО «Дементьева-Виноградов»;8 (694) 059-51-03;Афганистан;2005-11-14;с. Углегорск, бул. Никитина, д. 2, 423794
688;КДВ Групп;81624817673;Колумбия;1980-05-09;г. Морозовск, ш. Мичурина, д. 5/1, 361543
689;АО «Шестаков, Брагин и Ларионова»;+7 (432) 595-3796;Ливия;1971-03-08;г. Качканар, пр. 60 лет СССР, д. 6, 809092
690;Титан;+78208679830;Перу;1966-07-16;п. Тутаев, ш. Маяковского, д. 6 к. 7/2, 139017
691;ЗАО «Силин-Николаев»;8 165 906 8237;Вьетнам;2019-11-30;с. Тюмень, наб. Ветеранов, д. 61 к. 5/1, 770197
692;НПО «Ларионова-Михеева»;+7 (183) 389-45-50;Латвия;1987-06-03;д. Сузун, ул. Байкальская, д. 81, 163576
693;ОАО «Турова-Савельева»;+74652191559;Лесото;2012-11-28;к. Гусь-Хрустальный, алл. Союзная, д. 523 к. 6, 940350
694;ДНС Групп;87813596631;Ливан;2005-08-08;ст. Красноуральск, алл. Рылеева, д. 4 стр. 8, 448684
695;НПО «Казакова Федотова»;8 (597) 113-22-51;Белиз;1914-04-07;к. Курчатов, пр. Амурский, д. 9 к. 9, 233136
696;ВО Промсырьеимпорт;8 (516) 982-4021;Сент-Винсент и Гренадины;1950-09-02;п. Сосногорск, пр. Металлистов, д. 4/4, 888471
697;Кудрявцева Групп;8 (073) 937-35-05;Марокко;1906-01-14;г. Избербаш, наб. Димитрова, д. 43 к. 949, 227256
698;ООО «Носкова Крюкова»;8 832 121 70 26;Ливия;1984-12-14;клх Томпа, ш. Народное, д. 64, 156239
699;ОАО «Кабанов, Федотова и Меркушева»;8 847 210 0789;Сальвадор;1995-01-25;к. Сибай, алл. Микрорайон, д. 5 стр. 316, 761927
700;ИП «Зыкова»;8 (143) 838-7027;Самоа;1906-09-11;клх Улан-Удэ, алл. Советской Армии, д. 7 стр. 94, 510546
701;НПО «Орехов Панфилова»;8 148 017 40 32;Парагвай;2001-02-23;к. Магас, ш. Победа, д. 5 стр. 202, 413752
702;Кордиант;+7 537 321 19 17;Мали;1945-09-02;п. Ухта, ул. Волгоградская, д. 6/3 к. 72, 302524
703;Морозова Инк;+7 (823) 383-17-71;Сингапур;1951-11-08;г. Владикавказ, наб. Почтовая, д. 1/8, 628661
704;ОАО «Мишин»;8 (915) 172-2052;Ирландия;1902-06-15;д. Тулун, ш. Тракторное, д. 84, 406039
705;ИП «Исаков»;8 (580) 936-20-89;Киргизия;1960-06-13;г. Чайковский, ул. 50 лет ВЛКСМ, д. 87 стр. 5/1, 264460
706;ЗАО «Фокина»;+7 960 521 4731;Экваториальная Гвинея;1980-06-18;г. Хабаровск, ш. Бабушкина, д. 73 стр. 23, 182786
707;Якушев Лимитед;+77879147645;Албания;1906-07-19;к. Черский, алл. Леваневского, д. 6/6 к. 41, 133579
708;ОАО «Абрамов»;8 (967) 796-4951;Исландия;2019-04-12;клх Долинск, ш. Невского, д. 1 стр. 35, 270910
709;ИП «Кабанов Морозова»;83141922119;Малайзия;2005-06-29;клх Котлас, бул. Дружбы, д. 687 стр. 460, 008168
710;ИП «Вишняков Миронов»;89940744928;Ирландия;2014-02-11;с. Шерегеш, пер. Грибоедова, д. 211, 317014
711;НПО «Уваров-Быкова»;+7 (786) 165-0044;Португалия;1995-01-28;ст. Приозерск, пер. Тельмана, д. 8/8, 268455
712;Архипова Инкорпорэйтед;8 (385) 950-6967;Намибия;2016-03-07;к. Санкт-Петербург, пр. 70 лет Октября, д. 5/6 стр. 2, 506525
713;РАО «Исакова»;+7 (682) 552-29-43;Мексика;1962-07-27;г. Гаврилов-Ям, наб. Калужская, д. 4/2, 124742
714;ОАО «Дроздов, Цветкова и Сысоева»;87997869316;Черногория;2017-02-17;ст. Меренга, пер. Интернациональный, д. 5/5 к. 3/2, 022482
715;ЗАО «Шарапова, Фомин и Борисова»;8 (189) 290-5034;Исландия;1980-03-25;к. Краснокамск, ш. Первомайское, д. 54 стр. 9, 218992
716;Галкин Групп;8 737 672 80 01;Демократическая Республика Конго;1947-12-10;ст. Ржев, алл. Станиславского, д. 56, 143217
717;Скания-Русь (Scania);8 924 278 31 65;Федеративные Штаты Микронезии;1963-06-02;п. Уэлен, пер. Проточный, д. 5 стр. 17, 234458
718;ОАО «Харитонов»;+7 489 248 35 59;Сальвадор;1937-10-09;г. Канск, бул. Никитина, д. 3 стр. 834, 948971
719;ООО «Мишин»;8 815 319 09 32;Малави;1953-06-20;к. Тобольск, пер. Виноградный, д. 947, 278031
720;Ершов Инк;8 316 374 3107;Доминика;1964-04-25;г. Красная Поляна, алл. Авиационная, д. 463 стр. 85, 256101
721;АО «Быков, Антонова и Крюкова»;+76017527933;Гана;1987-05-16;д. Курильск, ул. Украинская, д. 98 стр. 8/3, 427005
722;ИП «Новикова Корнилова»;8 352 221 8207;Барбадос;2007-02-22;ст. Ирбит, бул. Торговый, д. 9/8 стр. 87, 627861
723;АО «Кононова Хохлова»;8 (182) 657-7845;Восточный Тимор;1960-05-29;клх Егорьевск, наб. Крестьянская, д. 9/1 стр. 8, 998193
724;АО «Казаков»;+7 475 316 17 94;Камбоджа;1938-09-18;к. Петухово, пр. Карьерный, д. 948 к. 7, 874147
725;Российские сети;83966174748;Нигер;1912-06-28;клх Беслан, пер. Николаева, д. 2/7 к. 8, 301465
726;ОАО «Тимофеева Веселова»;+71922434975;Самоа;1962-03-18;клх Тосно, бул. Садовый, д. 9 стр. 7/9, 484557
727;ЗАО «Самойлова-Соколов»;8 069 944 86 80;Азербайджан;2004-07-22;п. Серафимович, наб. Механизаторов, д. 757 к. 5, 237063
728;РАО «Лукина»;+7 697 882 39 46;Восточный Тимор;1963-11-24;п. Орехово-Зуево, ул. Жданова, д. 748 к. 6, 956368
729;АО «Воробьева-Рогов»;8 808 649 9808;Италия;1982-05-11;клх Лазаревское, ул. Крымская, д. 77 к. 1, 116771
730;АО «Морозова»;+75466652469;Демократическая Республика Конго;1949-09-18;д. Октябрьское (Челяб.), ш. Ясное, д. 17 стр. 1, 970791
731;Исакова Лимитед;+7 (012) 964-44-23;Тонга;1996-07-17;ст. Шуя, ул. Коминтерна, д. 23, 970711
732;ООО «Бирюкова-Уварова»;+7 (339) 340-8841;Литва;1956-10-06;клх Яр-Сале, пер. Вишневый, д. 60, 869015
733;ООО «Голубева, Гордеева и Овчинникова»;+7 (651) 083-73-03;Коморы;1991-09-26;п. Соль-Илецк, пр. Брянский, д. 285, 251572
734;АО «Игнатьев Жуков»;+7 (888) 813-6509;Черногория;1958-08-10;д. Карабудахкент, ш. Подгорное, д. 6 к. 94, 816791
735;ЗАО «Тимофеев Абрамов»;+7 190 190 2527;Бутан;1995-07-19;клх Сыктывкар, алл. Красных Партизан, д. 1/1 к. 4, 781306
736;ИП «Николаева, Некрасов и Семенова»;8 (240) 073-92-66;Бангладеш;1912-02-21;п. Соболево, пер. Угловой, д. 8/5, 200698
737;Ефремов и партнеры;+7 357 670 97 21;Ирак;2014-12-06;клх Северодвинск, пер. Молодежный, д. 3, 198853
738;АО «Крюкова, Шарапова и Гришин»;8 421 505 29 75;Испания;1997-08-23;п. Певек, бул. Запрудный, д. 2/3 стр. 5/8, 654242
739;НПО «Исаев Романова»;8 (284) 023-3411;Кения;2022-01-05;с. Крымск, пр. Минский, д. 6/6 стр. 6, 422662
740;ИП «Князева-Горбунов»;+7 842 654 6842;Сирия;2008-08-24;д. Старый Оскол, бул. Кедровый, д. 654 к. 3/1, 434094
741;ОАО «Абрамова-Юдин»;+7 013 124 4235;Либерия;2005-09-23;г. Коломна, алл. Лесозаводская, д. 769, 960093
742;АО «Жуков»;8 (824) 254-78-38;Ирландия;1918-11-26;г. Сызрань, ул. Новгородская, д. 444 к. 5/4, 744482
743;ОАО «Комаров»;+7 (421) 225-8076;Судан;2008-10-31;к. Верхоянск, ш. Западное, д. 1/6 к. 148, 418967
744;ЗАО «Кузнецов, Ершов и Жукова»;8 572 238 8811;Замбия;1980-07-18;с. Надым, ш. Клубное, д. 6 к. 2/7, 388931
745;НПО «Шестаков-Щукин»;+7 (027) 466-2787;Лесото;1916-05-10;г. Шарья, алл. Хуторская, д. 6/1 к. 9, 946525
746;Молчанова Лтд;+7 (826) 821-10-88;Германия;1945-10-18;п. Хоста, ул. Гафури, д. 374 стр. 760, 818724
747;Аксенов Лимитед;8 (635) 350-6794;Словакия;1977-04-03;п. Малгобек, пр. Шаумяна, д. 8/9 стр. 2/9, 496409
748;Торговая сеть Красное и Белое;86515912145;Австрия;1968-04-07;с. Мичуринск, алл. Безымянная, д. 3/7, 130441
749;Кузнецова Инкорпорэйтед;+79960697545;Республика Корея;1922-02-20;п. Ведено, наб. Волжская, д. 761 стр. 4, 627812
750;НПО «Лукина-Кулакова»;8 (307) 761-20-22;Израиль;1908-05-14;к. Вытегра, ш. Беляева, д. 2, 363422
751;Капустин Групп;+7 536 571 3965;Колумбия;1917-01-23;к. Гатчина, пр. Ульянова, д. 273 стр. 6/9, 916847
752;БАСФ (BASF);+74042349014;Франция;2021-10-29;г. Усть-Илимск, бул. Крымский, д. 6/1 к. 4, 433761
753;ЗАО «Федосеев, Виноградов и Селиверстов»;88556991620;Чили;1946-09-15;ст. Химки, пр. Краснофлотский, д. 99 к. 6/9, 804257
754;НПО «Лебедева, Ширяев и Волков»;+7 238 900 75 50;Туркмения;1917-11-07;к. Радужный, наб. Дальневосточная, д. 734 стр. 894, 539031
755;ООО «Доронина Исакова»;86300691605;Эритрея;1947-12-09;г. Озеры, пер. Ангарский, д. 76 к. 618, 436840
756;ЛокоТех;+76514442395;Словакия;1940-05-14;ст. Токсово, бул. Кедровый, д. 679, 778075
757;РАО «Рогов Князев»;+7 163 254 8445;Саудовская Аравия;1956-05-27;к. Объячево, наб. Волкова, д. 2/2 стр. 7/8, 577088
758;НПО «Емельянов-Дорофеева»;8 (992) 467-6274;Гватемала;2013-06-01;с. Суздаль, алл. Севастопольская, д. 9 к. 339, 632134
759;Углетранс;+7 462 127 63 22;Чехия;1919-03-31;д. Кашира, ш. Мельничное, д. 3/2 стр. 7, 123035
760;Молчанов Групп;+7 (207) 074-7459;Саудовская Аравия;1987-09-13;д. Приморско-Ахтарск, ш. Сахалинское, д. 8, 496241
761;НПО «Сазонов-Логинова»;8 444 270 65 49;Кабо-Верде;2006-06-28;ст. Грозный, наб. Новосельская, д. 4 стр. 2, 611928
762;АО «Казаков Максимова»;+7 (957) 260-74-87;Финляндия;2020-08-16;клх Октябрьское (Хант.), пр. Белинского, д. 3/5 к. 4/9, 909905
763;НПО «Гущина-Беляков»;+7 374 893 5113;Кувейт;2005-12-06;к. Тула, пр. 9 Января, д. 530 стр. 544, 177697
764;НПО «Титова-Киселева»;8 392 954 9354;Багамские Острова;1946-09-25;п. Ржев, алл. Физкультурная, д. 1 стр. 37, 893379
765;Ермаков Инк;+7 (947) 288-2908;Сьерра-Леоне;1964-11-03;д. Костомукша, алл. Дорожная, д. 5/8, 506349
766;ЗАО «Логинов-Новикова»;+7 597 875 86 70;Мозамбик;1952-01-10;к. Ербогачен, пр. Мая 1, д. 6, 446739
767;Стройгазмонтаж;8 062 292 62 54;Кувейт;1930-10-24;ст. Старый Оскол, алл. Спортивная, д. 6 стр. 6, 191242
768;Рив Гош;+7 (224) 604-3964;Папуа;1991-04-08;д. Боровск, бул. Водников, д. 5/6, 995320
769;ИП «Хохлов-Калашникова»;+7 (701) 083-5975;Украина;1919-01-11;к. Великий Устюг, пр. Клары Цеткин, д. 9, 638974
770;РАО «Зайцева-Одинцов»;+77902815879;Венесуэла;1926-11-27;к. Черняховск, бул. Выгонный, д. 176 стр. 3, 601115
771;Нестеров Инкорпорэйтед;+7 (129) 204-23-26;Мозамбик;1960-06-15;д. Йошкар-Ола, ул. Орловская, д. 4/5 к. 344, 558043
772;РАО «Елисеев, Васильева и Кулагина»;+76915887300;Уругвай;1937-03-02;к. Новомосковск, ш. Авиационное, д. 93 к. 355, 734222
773;ООО «Калашникова, Комиссаров и Мельникова»;8 652 063 0690;Монако;1971-11-11;д. Боровск, пер. Новоселов, д. 8/1, 396998
774;Осипова Лтд;8 (197) 791-6924;Коста-Рика;1934-11-03;г. Пермь, пр. Фадеева, д. 2/4, 997029
775;ЗАО «Русаков»;8 (984) 046-8217;Бурунди;2001-09-28;п. Новый Уренгой, пер. Карла Либкнехта, д. 3 стр. 5, 137176
776;Рябова и партнеры;+7 311 888 51 73;Бурунди;1958-09-21;ст. Сызрань, ул. Партизанская, д. 3/4, 229035
777;ЗАО «Евдокимов»;+7 (556) 990-15-60;Россия;1903-08-22;к. Бронницы, ш. Вольное, д. 933 стр. 9/5, 333145
778;ООО «Рожков, Калинина и Силина»;+77266755805;Мьянма;2010-06-01;с. Вязьма, пер. Мирный, д. 9, 004615
779;Петропавловск;+7 (645) 042-48-69;Мозамбик;1949-04-22;д. Рыльск, ш. Правды, д. 4 к. 301, 770914
780;РАО «Захарова-Шилова»;85540659702;Россия;1900-11-28;с. Томск, наб. Нефтяников, д. 5 к. 844, 464082
781;Техинком;8 369 379 73 75;Вьетнам;1970-02-16;к. Борзя, ш. Мелиораторов, д. 1, 346675
782;НПО «Антонов Беляев»;+7 (716) 217-01-60;Зимбабве;2012-12-22;п. Ноглики, ул. Пушкинская, д. 1, 097798
783;Соколов Лтд;8 (065) 397-87-90;Перу;2002-08-21;клх Углегорск, наб. Высоковольтная, д. 1, 812253
784;РАО «Алексеев, Лихачева и Калашников»;8 (298) 138-22-29;Венгрия;1916-03-21;клх Салават, алл. Тихая, д. 8/6, 328575
785;АО «Белозерова»;+7 354 421 53 61;Антигуа и Барбуда;1964-03-16;клх Билибино, бул. Ермака, д. 136, 372769
786;ОАО «Аксенова-Зайцева»;8 (560) 524-8752;Монголия;1995-05-10;ст. Талдом, бул. Гражданский, д. 8/2 к. 18, 835299
787;ЗАО «Осипова, Шарова и Петухова»;8 (314) 704-9004;Ангола;1910-08-02;к. Чермоз, бул. Геологический, д. 419 стр. 9, 975735
788;Русакова Лтд;8 883 177 7716;Антигуа и Барбуда;1983-12-10;с. Аша, пер. Смоленский, д. 2/3 стр. 7, 459433
789;НПО «Костина Игнатьев»;+75524521663;Соломоновы Острова;1997-09-16;к. Яр-Сале, пер. Механизаторов, д. 3/4, 249188
790;АО «Сорокин»;+7 385 057 4759;Молдавия;1994-09-06;д. Калач-на-Дону, наб. Крупской, д. 165 к. 3, 398960
791;Автодом;+7 956 628 37 67;Исландия;1965-10-26;д. Хоста, ш. Верхнее, д. 597 стр. 3/6, 174994
792;Авдеева Лимитед;+7 592 161 70 88;Куба;1970-06-23;ст. Карабулак, ул. Карла Маркса, д. 5, 396947
793;ИП «Лукин-Галкин»;+7 (707) 054-68-72;Того;1941-06-03;с. Переславль-Залесский, бул. Прохладный, д. 18 стр. 2, 667180
794;ООО «Соколова, Воронцова и Доронин»;86464732070;Маврикий;1947-02-26;п. Томпа, бул. Профсоюзный, д. 15 к. 894, 618777
795;Глория Джинс;8 (256) 439-9907;Зимбабве;1989-08-08;ст. Минеральные Воды, пер. Безымянный, д. 5/3 к. 9/6, 516568
796;ОАО «Аксенова, Елисеев и Кириллов»;+7 (927) 133-06-12;Белоруссия;1960-02-02;г. Прохладный, наб. Народная, д. 218 к. 9/3, 435231
797;Селиверстов Инк;+73665196674;Мальта;1954-06-14;п. Братск, пер. Строительный, д. 3/1 к. 9/8, 763981
798;ЗАО «Полякова, Жуков и Гуляева»;8 (008) 032-4463;Индонезия;1922-01-26;к. Сергиев Посад, ш. Степана Разина, д. 66 к. 7/1, 510248
799;ООО «Матвеев, Щукин и Брагина»;+7 (397) 201-46-60;Северная Македония;1930-07-11;с. Кудымкар, алл. 50 лет ВЛКСМ, д. 987 стр. 4/2, 608312
800;Яндекс;+7 (320) 299-36-27;Мадагаскар;1960-11-10;п. Хабаровск, наб. Флотская, д. 295 к. 8, 079712
801;ООО «Лапин, Прохоров и Веселова»;+7 818 988 9173;Зимбабве;1983-10-20;ст. Славянск-на-Кубани, наб. Черемуховая, д. 47 стр. 8, 003475
802;Русэнергоресурс;8 236 313 97 47;Сербия;1971-09-13;д. Нарым, наб. Циолковского, д. 75, 457188
